{
  "schema_version": 1,
  "oracle": {
    "implementation": "unchanged original Python functions",
    "source_sha256": {
      "wb_proxy.py": "19802f3b69dce0b2be078fa611051f3b411ec341ce512bef7946273b4b013bc1",
      "wb_accounts.py": "f959f4520c85229ea992c780afad88fcd312381dce2303578ff232db4d449d90",
      "wb_settings.py": "54d98d2555212f164e44204c7f64b5c3e7918556acf4a26a9b6007fdb824afcc"
    },
    "determinism": {
      "epoch_seconds": 1700000000.0,
      "uuid4": "per case counter n starts at 1; hex = format(n, '016x') repeated twice",
      "json_comparison": "object key order ignored; array order and strings exact; tuples exported as arrays",
      "settings": "isolated empty settings; handler egress backoff disabled; recording captured in memory"
    },
    "constants": {
      "FAIL_WINDOW": 600.0,
      "BREAKER_THRESHOLD": 3,
      "BREAKER_COOLDOWN": 1800.0,
      "BREAKER_COOLDOWN_MAX": 21600.0,
      "DEGRADE_THRESHOLD": 5,
      "DEGRADE_COOLDOWN": 600.0,
      "SOFT_RATE_BASE": 600.0,
      "SOFT_RATE_MAX": 7200.0,
      "SOFT_RATE_UNVERIFIED_BASE": 60.0,
      "SOFT_RATE_UNVERIFIED_MAX": 600.0,
      "RESTRICTED_ACCOUNT_COOLDOWN": 7200.0
    }
  },
  "case_count": 115,
  "cases": [
    {
      "id": "schema.empty",
      "operation": "wb_proxy._normalize_tool_parameters",
      "kind": "mutated_arg0",
      "input": {
        "args": [
          {
            "name": "f",
            "parameters": {}
          }
        ],
        "kwargs": {}
      },
      "expected": {
        "name": "f",
        "parameters": {
          "type": "object",
          "properties": {}
        }
      }
    },
    {
      "id": "schema.null",
      "operation": "wb_proxy._normalize_tool_parameters",
      "kind": "mutated_arg0",
      "input": {
        "args": [
          {
            "name": "f",
            "parameters": null
          }
        ],
        "kwargs": {}
      },
      "expected": {
        "name": "f",
        "parameters": {
          "type": "object",
          "properties": {}
        }
      }
    },
    {
      "id": "schema.list",
      "operation": "wb_proxy._normalize_tool_parameters",
      "kind": "mutated_arg0",
      "input": {
        "args": [
          {
            "name": "f",
            "parameters": []
          }
        ],
        "kwargs": {}
      },
      "expected": {
        "name": "f",
        "parameters": {
          "type": "object",
          "properties": {}
        }
      }
    },
    {
      "id": "schema.string",
      "operation": "wb_proxy._normalize_tool_parameters",
      "kind": "mutated_arg0",
      "input": {
        "args": [
          {
            "name": "f",
            "parameters": "bad"
          }
        ],
        "kwargs": {}
      },
      "expected": {
        "name": "f",
        "parameters": {
          "type": "object",
          "properties": {}
        }
      }
    },
    {
      "id": "schema.bool",
      "operation": "wb_proxy._normalize_tool_parameters",
      "kind": "mutated_arg0",
      "input": {
        "args": [
          {
            "name": "f",
            "parameters": true
          }
        ],
        "kwargs": {}
      },
      "expected": {
        "name": "f",
        "parameters": {
          "type": "object",
          "properties": {}
        }
      }
    },
    {
      "id": "schema.recursive",
      "operation": "wb_proxy._normalize_tool_parameters",
      "kind": "mutated_arg0",
      "input": {
        "args": [
          {
            "name": "f",
            "parameters": {
              "type": "dict",
              "required": [
                "a",
                null,
                "a",
                7,
                ""
              ],
              "properties": {
                "a": {
                  "type": "int",
                  "description": null
                },
                "b": {
                  "type": "list",
                  "items": [
                    {
                      "type": "str",
                      "title": null
                    },
                    {
                      "type": "float"
                    }
                  ]
                },
                "c": {
                  "anyOf": [
                    {
                      "type": "bool"
                    },
                    {
                      "type": "null"
                    }
                  ]
                }
              },
              "$defs": {
                "T": {
                  "type": "dict",
                  "properties": {
                    "x": {
                      "type": "float",
                      "format": null
                    }
                  }
                }
              }
            }
          }
        ],
        "kwargs": {}
      },
      "expected": {
        "name": "f",
        "parameters": {
          "type": "object",
          "required": [
            "a",
            "a",
            "7"
          ],
          "properties": {
            "a": {
              "type": "integer"
            },
            "b": {
              "type": "array",
              "items": {
                "type": "string"
              }
            },
            "c": {
              "anyOf": [
                {
                  "type": "boolean"
                },
                {
                  "type": "null"
                }
              ]
            }
          },
          "$defs": {
            "T": {
              "type": "object",
              "properties": {
                "x": {
                  "type": "number"
                }
              }
            }
          }
        }
      }
    },
    {
      "id": "schema.required_string",
      "operation": "wb_proxy._normalize_tool_parameters",
      "kind": "mutated_arg0",
      "input": {
        "args": [
          {
            "name": "f",
            "parameters": {
              "properties": {
                "x": {}
              },
              "required": "x"
            }
          }
        ],
        "kwargs": {}
      },
      "expected": {
        "name": "f",
        "parameters": {
          "properties": {
            "x": {}
          },
          "required": [
            "x"
          ],
          "type": "object"
        }
      }
    },
    {
      "id": "schema.required_null",
      "operation": "wb_proxy._normalize_tool_parameters",
      "kind": "mutated_arg0",
      "input": {
        "args": [
          {
            "name": "f",
            "parameters": {
              "properties": {
                "x": {}
              },
              "required": null
            }
          }
        ],
        "kwargs": {}
      },
      "expected": {
        "name": "f",
        "parameters": {
          "properties": {
            "x": {}
          },
          "type": "object"
        }
      }
    },
    {
      "id": "tools.legacy",
      "operation": "wb_proxy.normalize_tools",
      "kind": "mutated_arg0",
      "input": {
        "args": [
          {
            "functions": [
              {
                "name": "legacy",
                "parameters": {}
              }
            ]
          }
        ],
        "kwargs": {}
      },
      "expected": {
        "tools": [
          {
            "type": "function",
            "function": {
              "name": "legacy",
              "parameters": {
                "type": "object",
                "properties": {}
              }
            }
          }
        ]
      }
    },
    {
      "id": "tools.empty",
      "operation": "wb_proxy.normalize_tools",
      "kind": "mutated_arg0",
      "input": {
        "args": [
          {
            "tools": []
          }
        ],
        "kwargs": {}
      },
      "expected": {}
    },
    {
      "id": "tools.flat",
      "operation": "wb_proxy.normalize_tools",
      "kind": "mutated_arg0",
      "input": {
        "args": [
          {
            "tools": [
              {
                "name": "flat",
                "parameters": {}
              },
              {
                "type": "function",
                "name": "f",
                "parameters": null
              }
            ]
          }
        ],
        "kwargs": {}
      },
      "expected": {
        "tools": [
          {
            "type": "function",
            "function": {
              "name": "flat",
              "description": "",
              "parameters": {
                "type": "object",
                "properties": {}
              }
            }
          },
          {
            "type": "function",
            "function": {
              "name": "f",
              "description": "",
              "parameters": {
                "type": "object",
                "properties": {}
              }
            }
          }
        ]
      }
    },
    {
      "id": "arguments.scalar_and_unicode",
      "operation": "wb_proxy.sanitize_tool_calls",
      "kind": "return",
      "input": {
        "args": [
          [
            {
              "id": "c0",
              "type": "function",
              "function": {
                "name": "f",
                "arguments": {
                  "city": "北京"
                }
              }
            },
            {
              "id": "c1",
              "type": "function",
              "function": {
                "name": "f",
                "arguments": null
              }
            },
            {
              "id": "c2",
              "type": "function",
              "function": {
                "name": "f",
                "arguments": "{\"x\":1}"
              }
            },
            {
              "id": "c3",
              "type": "function",
              "function": {
                "name": "f",
                "arguments": [
                  1,
                  "a"
                ]
              }
            },